{
	"Name": "StrikeBoomerang",
	"Stage": 0,
	"Tier": 0,
	"Variation": "Original",
	"Type": "Normal",
	"CombatAffinity": "Fire",
	"CombatClass": "Fighter",
	"DominantCombatAffinity": "Fire",
	"DominantCombatClass": "Fighter",
	"Stats": {
		"MaxHealth": 500000,
		"StartingEnergy": 10000,
		"EnergyCost": 120000,
		"PhysicalResist": 40,
		"EnergyResist": 20,
		"TenacityPercentage": 0,
		"WillpowerPercentage": 0,
		"Grit": 0,
		"Resolve": 0,
		"AttackPhysicalDamage": 70000,
		"AttackEnergyDamage": 0,
		"AttackPureDamage": 0,
		"AttackSpeed": 100,
		"MoveSpeedSubUnits": 0,
		"HitChancePercentage": 100,
		"AttackDodgeChancePercentage": 0,
		"CritChancePercentage": 25,
		"CritAmplificationPercentage": 150,
		"OmegaPowerPercentage": 100,
		"AttackRangeUnits": 60,
		"OmegaRangeUnits": 0,
		"HealthRegeneration": 0,
		"EnergyRegeneration": 0,
		"EnergyGainEfficiencyPercentage": 100,
		"OnActivationEnergy": 0,
		"VulnerabilityPercentage": 100,
		"EnergyPiercingPercentage": 0,
		"PhysicalPiercingPercentage": 0,
		"HealthGainEfficiencyPercentage": 100,
		"PhysicalVampPercentage": 0,
		"EnergyVampPercentage": 0,
		"PureVampPercentage": 0,
		"Thorns": 0,
		"StartingShield": 0,
		"CritReductionPercentage": 0
	},
	"AttackAbilitiesSelection": "Cycle",
	"AttackAbilities": [
		{
			"Name": "Boomerang Attack I",
			"Skills": [
				{
					"Name": "Attack",
					"Targeting": {
						"Type": "CurrentFocus"
					},
					"Deployment": {
						"Type": "Projectile",
						"PreDeploymentDelayPercentage": 40
					},
					"Projectile": {
						"SizeUnits": 0,
						"IsHoming": true,
						"SpeedSubUnits": 10000,
						"IsBlockable": false,
						"ApplyToAll": false
					},
					"EffectPackage": {
						"Effects": [
							{
								"Type": "InstantDamage",
								"DamageType": "Physical",
								"Expression": {
									"Stat": "AttackPhysicalDamage",
									"StatSource": "Sender"
								}
							},
							{
								"Type": "InstantDamage",
								"DamageType": "Energy",
								"Expression": {
									"Stat": "AttackEnergyDamage",
									"StatSource": "Sender"
								}
							},
							{
								"Type": "InstantDamage",
								"DamageType": "Pure",
								"Expression": {
									"Stat": "AttackPureDamage",
									"StatSource": "Sender"
								}
							}
						]
					}
				}
			]
		}
	],
	"OmegaAbilitiesSelection": "Cycle",
	"OmegaAbilities": [
		{
			"Name": "Ignition Circuit I",
			"TotalDurationMs": 2000,
			"Skills": [
				{
					"Name": "Boomerang",
					"Targeting": {
						"Type": "DistanceCheck",
						"Guidance": [
							"Ground",
							"Underground",
							"Airborne"
						],
						"Group": "Enemy",
						"Lowest": false,
						"Num": 1
					},
					"Deployment": {
						"Type": "Projectile",
						"Guidance": [
							"Ground",
							"Airborne"
						],
						"PreDeploymentDelayPercentage": 50
					},
					"PercentageOfAbilityDuration": 100,
					"Projectile": {
						"SizeUnits": 3,
						"IsHoming": true,
						"SpeedSubUnits": 10000,
						"IsBlockable": false,
						"ApplyToAll": true
					},
					"EffectPackage": {
						"Effects": [
							{
								"ID": "ImpactMagnifier",
								"Type": "InstantDamage",
								"DamageType": "Physical",
								"Expression": {
									"Operation": "*",
									"Operands": [
										300000,
										{
											"Stat": "OmegaPowerPercentage",
											"StatSource": "Sender"
										}
									]
								}
							}
						]
					}
				}
			]
		}
	],
	"DisplayName": "Strike Boomerang",
	"DisplayDescription": "The Ranger throws the boomerang at the furthest enemy in range, dealing 300 Physical Damage to all enemies hit by it.",
	"Description": {
		"Format": "The Ranger throws the boomerang at the furthest enemy in range, dealing 300 Physical Damage to all enemies hit by it.",
		"Parameters": {}
	},
	"DisplayDescriptionNormalized": "The Ranger throws the boomerang at the furthest enemy in range, dealing 300 Physical Damage to all enemies hit by it."
}