{
	"Name": "LavaGauntletCumulativeIgnition",
	"Stage": 0,
	"Tier": 0,
	"Variation": "Original",
	"Type": "Amplifier",
	"AmplifierForWeapon": {
		"Name": "LavaGauntlet",
		"Stage": 0,
		"Variation": "Original",
		"CombatAffinity": "Fire"
	},
	"Stats": {
		"MaxHealth": 400000,
		"StartingEnergy": 0,
		"EnergyCost": 0,
		"PhysicalResist": 0,
		"EnergyResist": 0,
		"TenacityPercentage": 0,
		"WillpowerPercentage": 0,
		"Grit": 0,
		"Resolve": 0,
		"AttackPhysicalDamage": 0,
		"AttackEnergyDamage": 0,
		"AttackPureDamage": 0,
		"AttackSpeed": 0,
		"MoveSpeedSubUnits": 0,
		"HitChancePercentage": 0,
		"AttackDodgeChancePercentage": 0,
		"CritChancePercentage": 0,
		"CritAmplificationPercentage": 0,
		"OmegaPowerPercentage": 0,
		"AttackRangeUnits": 0,
		"OmegaRangeUnits": 0,
		"HealthRegeneration": 0,
		"EnergyRegeneration": 0,
		"EnergyGainEfficiencyPercentage": 0,
		"OnActivationEnergy": 0,
		"VulnerabilityPercentage": 0,
		"EnergyPiercingPercentage": 0,
		"PhysicalPiercingPercentage": 0,
		"HealthGainEfficiencyPercentage": 0,
		"PhysicalVampPercentage": 0,
		"EnergyVampPercentage": 0,
		"PureVampPercentage": 0,
		"Thorns": 0,
		"StartingShield": 0,
		"CritReductionPercentage": 0
	},
	"AttackAbilitiesSelection": "Cycle",
	"AttackAbilities": [],
	"OmegaAbilitiesSelection": "Cycle",
	"OmegaAbilities": [],
	"InnateAbilities": [
		{
			"Name": "CumulativeIgnition",
			"ActivationTrigger": {
				"TriggerType": "OnActivateXAbilities",
				"AbilityTypes": [
					"Omega"
				],
				"EveryX": true,
				"NumberOfAbilitiesActivated": 1
			},
			"TotalDurationMs": 0,
			"Skills": [
				{
					"Name": "CumulativeIgnition - Self Buff",
					"Deployment": {
						"Type": "Direct"
					},
					"Targeting": {
						"Type": "Self"
					},
					"EffectPackage": {
						"Effects": [
							{
								"Type": "Buff",
								"Stat": "AttackPhysicalDamage",
								"OverlapProcessType": "Stacking",
								"DurationMs": -1,
								"Expression": {
									"Percentage": 10,
									"Stat": "AttackPhysicalDamage",
									"StatSource": "Receiver",
									"StatEvaluationType": "Base"
								}
							},
							{
								"Type": "Buff",
								"Stat": "AttackEnergyDamage",
								"OverlapProcessType": "Stacking",
								"DurationMs": -1,
								"Expression": {
									"Percentage": 10,
									"Stat": "AttackEnergyDamage",
									"StatSource": "Receiver",
									"StatEvaluationType": "Base"
								}
							},
							{
								"Type": "Buff",
								"Stat": "AttackPureDamage",
								"OverlapProcessType": "Stacking",
								"DurationMs": -1,
								"Expression": {
									"Percentage": 10,
									"Stat": "AttackPureDamage",
									"StatSource": "Receiver",
									"StatEvaluationType": "Base"
								}
							},
							{
								"Type": "Buff",
								"Stat": "EnergyPiercingPercentage",
								"OverlapProcessType": "Stacking",
								"DurationMs": -1,
								"Expression": 10
							}
						]
					}
				}
			]
		}
	],
	"DisplayName": "Cumulative Ignition",
	"DisplayDescription": "On Omega, gain 10% Energy Piercing and 10 Attack Damage for the rest of the combat.",
	"Description": {
		"Format": "On Omega, gain 10% Energy Piercing and 10 Attack Damage for the rest of the combat.",
		"Parameters": {}
	},
	"DisplayDescriptionNormalized": "On Omega, gain 10% Energy Piercing and 10 Attack Damage for the rest of the combat."
}