{
	"Name": "EmberBastionHeatConversion",
	"Stage": 0,
	"Tier": 0,
	"Variation": "Original",
	"Type": "Amplifier",
	"AmplifierForWeapon": {
		"Name": "EmberBastion",
		"Stage": 0,
		"Variation": "Original",
		"CombatAffinity": "Earth"
	},
	"Stats": {
		"MaxHealth": 700000,
		"StartingEnergy": 0,
		"EnergyCost": 0,
		"PhysicalResist": 0,
		"EnergyResist": 0,
		"TenacityPercentage": 0,
		"WillpowerPercentage": 0,
		"Grit": 0,
		"Resolve": 0,
		"AttackPhysicalDamage": 0,
		"AttackEnergyDamage": 0,
		"AttackPureDamage": 0,
		"AttackSpeed": 0,
		"MoveSpeedSubUnits": 0,
		"HitChancePercentage": 0,
		"AttackDodgeChancePercentage": 0,
		"CritChancePercentage": 0,
		"CritAmplificationPercentage": 0,
		"OmegaPowerPercentage": 0,
		"AttackRangeUnits": 0,
		"OmegaRangeUnits": 0,
		"HealthRegeneration": 0,
		"EnergyRegeneration": 0,
		"EnergyGainEfficiencyPercentage": 0,
		"OnActivationEnergy": 0,
		"VulnerabilityPercentage": 0,
		"EnergyPiercingPercentage": 0,
		"PhysicalPiercingPercentage": 0,
		"HealthGainEfficiencyPercentage": 0,
		"PhysicalVampPercentage": 0,
		"EnergyVampPercentage": 0,
		"PureVampPercentage": 0,
		"Thorns": 0,
		"StartingShield": 0,
		"CritReductionPercentage": 0
	},
	"AttackAbilitiesSelection": "Cycle",
	"AttackAbilities": [],
	"OmegaAbilitiesSelection": "Cycle",
	"OmegaAbilities": [],
	"InnateAbilities": [],
	"EffectsReplacements": [
		{
			"ID": "HeatConversion",
			"Type": "Buff",
			"Stat": "OmegaPowerPercentage",
			"OverlapProcessType": "Stacking",
			"DurationMs": -1,
			"Expression": 2
		}
	],
	"DisplayName": "Heat Conversion",
	"DisplayDescription": "During Omega, gain 2 Omega Power for each attack you receive.",
	"Description": {
		"Format": "During Omega, gain 2 Omega Power for each attack you receive.",
		"Parameters": {}
	},
	"DisplayDescriptionNormalized": "During Omega, gain 2 Omega Power for each attack you receive."
}