{
	"Name": "Maul",
	"Stage": 1,
	"Tier": 5,
	"Variation": "Original",
	"Type": "Normal",
	"CombatAffinity": "Earth",
	"CombatClass": "Empath",
	"DominantCombatAffinity": "Earth",
	"DominantCombatClass": "Empath",
	"Stats": {
		"MaxHealth": 0,
		"StartingEnergy": 60000,
		"EnergyCost": 180000,
		"PhysicalResist": 0,
		"EnergyResist": 0,
		"TenacityPercentage": 0,
		"WillpowerPercentage": 0,
		"Grit": 0,
		"Resolve": 0,
		"AttackPhysicalDamage": 150000,
		"AttackEnergyDamage": 0,
		"AttackPureDamage": 0,
		"AttackSpeed": 60,
		"MoveSpeedSubUnits": 0,
		"HitChancePercentage": 100,
		"AttackDodgeChancePercentage": 0,
		"CritChancePercentage": 25,
		"CritAmplificationPercentage": 150,
		"OmegaPowerPercentage": 100,
		"AttackRangeUnits": 3,
		"OmegaRangeUnits": 3,
		"HealthRegeneration": 0,
		"EnergyRegeneration": 0,
		"EnergyGainEfficiencyPercentage": 100,
		"OnActivationEnergy": 0,
		"VulnerabilityPercentage": 100,
		"EnergyPiercingPercentage": 0,
		"PhysicalPiercingPercentage": 0,
		"HealthGainEfficiencyPercentage": 100,
		"PhysicalVampPercentage": 0,
		"EnergyVampPercentage": 0,
		"PureVampPercentage": 0,
		"Thorns": 0,
		"StartingShield": 0,
		"CritReductionPercentage": 0
	},
	"AttackAbilitiesSelection": "Cycle",
	"AttackAbilities": [
		{
			"Name": "Maul Attack I",
			"Skills": [
				{
					"Name": "Attack",
					"Targeting": {
						"Type": "CurrentFocus"
					},
					"Deployment": {
						"Type": "Direct",
						"PreDeploymentDelayPercentage": 50
					},
					"EffectPackage": {
						"Effects": [
							{
								"Type": "InstantDamage",
								"DamageType": "Physical",
								"Expression": {
									"Stat": "AttackPhysicalDamage",
									"StatSource": "Sender"
								}
							},
							{
								"Type": "InstantDamage",
								"DamageType": "Energy",
								"Expression": {
									"Stat": "AttackEnergyDamage",
									"StatSource": "Sender"
								}
							},
							{
								"Type": "InstantDamage",
								"DamageType": "Pure",
								"Expression": {
									"Stat": "AttackPureDamage",
									"StatSource": "Sender"
								}
							}
						]
					}
				}
			]
		}
	],
	"OmegaAbilitiesSelection": "Cycle",
	"OmegaAbilities": [
		{
			"Name": "Willbreaker I",
			"TotalDurationMs": 1500,
			"Skills": [
				{
					"Name": "LIFT THE MAUL",
					"Targeting": {
						"Type": "CurrentFocus"
					},
					"Deployment": {
						"Type": "Direct",
						"PreDeploymentDelayPercentage": 75
					},
					"PercentageOfAbilityDuration": 100,
					"EffectPackage": {
						"Effects": [
							{
								"Type": "NegativeState",
								"NegativeState": "Stun",
								"DurationMs": 2000
							}
						]
					}
				},
				{
					"Name": "AOE",
					"Targeting": {
						"Type": "InZone",
						"Group": "Enemy",
						"RadiusUnits": 20
					},
					"Deployment": {
						"Type": "Direct"
					},
					"PercentageOfAbilityDuration": 0,
					"EffectPackage": {
						"Effects": [
							{
								"Type": "InstantDamage",
								"DamageType": "Physical",
								"Expression": {
									"Operation": "*",
									"Operands": [
										250000,
										{
											"Stat": "OmegaPowerPercentage",
											"StatSource": "Sender"
										}
									]
								}
							}
						]
					}
				}
			]
		}
	],
	"DisplayName": "Shadow Maul",
	"DisplayDescription": "The Ranger channels dark energy into their maul, delivering a crushing blow that Stuns the target for 2 seconds. The impact creates a shockwave, dealing 250*OP Physical Damage to all enemies within 20 radius.\r\n\r\nAbyssal Maul: Gives Mud.\r\n\r\nDreadmarsh Maul: Gives Mud and Revenant.",
	"Description": {
		"Format": "The Ranger channels dark energy into their maul, delivering a crushing blow that Stuns the target for {a} seconds. The impact creates a shockwave, dealing {b}*OP Physical Damage to all enemies within {c} radius.\r\n\r\nAbyssal Maul: Gives Mud.\r\n\r\nDreadmarsh Maul: Gives Mud and Revenant.",
		"Parameters": {
			"a": {
				"ParameterPath": "OmegaAbilities[0].Skills[0].EffectPackage.Effects[0].DurationMs",
				"ValueMultiplier": 0.001
			},
			"b": {
				"ParameterPath": "OmegaAbilities[0].Skills[1].EffectPackage.Effects[0].Expression.Operands[0]",
				"ValueMultiplier": 0.001
			},
			"c": {
				"ParameterPath": "OmegaAbilities[0].Skills[1].Targeting.RadiusUnits"
			}
		}
	},
	"DisplayDescriptionNormalized": "The Ranger channels dark energy into their maul, delivering a crushing blow that Stuns the target for 2 seconds. The impact creates a shockwave, dealing 250*OP Physical Damage to all enemies within 20 radius.\r\n\r\nAbyssal Maul: Gives Mud.\r\n\r\nDreadmarsh Maul: Gives Mud and Revenant."
}
