{
	"Name": "EmberlingRodCauterizingPollination",
	"Stage": 0,
	"Tier": 0,
	"Variation": "Original",
	"Type": "Amplifier",
	"AmplifierForWeapon": {
		"Name": "EmberlingRod",
		"Stage": 0,
		"Variation": "Original",
		"CombatAffinity": "Nature"
	},
	"Stats": {
		"MaxHealth": 400000,
		"StartingEnergy": 0,
		"EnergyCost": 0,
		"PhysicalResist": 0,
		"EnergyResist": 0,
		"TenacityPercentage": 0,
		"WillpowerPercentage": 0,
		"Grit": 0,
		"Resolve": 0,
		"AttackPhysicalDamage": 0,
		"AttackEnergyDamage": 0,
		"AttackPureDamage": 0,
		"AttackSpeed": 0,
		"MoveSpeedSubUnits": 0,
		"HitChancePercentage": 0,
		"AttackDodgeChancePercentage": 0,
		"CritChancePercentage": 0,
		"CritAmplificationPercentage": 0,
		"OmegaPowerPercentage": 0,
		"AttackRangeUnits": 0,
		"OmegaRangeUnits": 0,
		"HealthRegeneration": 0,
		"EnergyRegeneration": 0,
		"EnergyGainEfficiencyPercentage": 0,
		"OnActivationEnergy": 0,
		"VulnerabilityPercentage": 0,
		"EnergyPiercingPercentage": 0,
		"PhysicalPiercingPercentage": 0,
		"HealthGainEfficiencyPercentage": 0,
		"PhysicalVampPercentage": 0,
		"EnergyVampPercentage": 0,
		"PureVampPercentage": 0,
		"Thorns": 0,
		"StartingShield": 0,
		"CritReductionPercentage": 0
	},
	"AttackAbilitiesSelection": "Cycle",
	"AttackAbilities": [],
	"OmegaAbilitiesSelection": "Cycle",
	"OmegaAbilities": [],
	"InnateAbilities": [],
	"EffectsReplacements": [
		{
			"ID": "CauterizingPollination",
			"Type": "Debuff",
			"Stat": "HealthGainEfficiencyPercentage",
			"OverlapProcessType": "Merge",
			"DurationMs": 5000,
			"Expression": 25
		},
		{
			"ID": "CauterizingPollination1",
			"Type": "DOT",
			"DamageType": "Energy",
			"DurationMs": 3000,
			"FrequencyMs": 1000,
			"Expression": {
				"Operation": "*",
				"Operands": [
					100000,
					{
						"Stat": "OmegaPowerPercentage",
						"StatSource": "Sender"
					}
				]
			}
		}
	],
	"DisplayName": "Cauterizing Pollination",
	"DisplayDescription": "The initial seed applies Burn for 3 seconds and deals 300 Energy Damage over the duration.",
	"Description": {
		"Format": "The initial seed applies Burn for 3 seconds and deals 300 Energy Damage over the duration.",
		"Parameters": {}
	},
	"DisplayDescriptionNormalized": "The initial seed applies Burn for 3 seconds and deals 300 Energy Damage over the duration."
}