{
	"Name": "AquaBlasterTidalPenetration",
	"Stage": 0,
	"Tier": 0,
	"Variation": "Original",
	"Type": "Amplifier",
	"AmplifierForWeapon": {
		"Name": "AquaBlaster",
		"Stage": 0,
		"Variation": "Original",
		"CombatAffinity": "Water"
	},
	"Stats": {
		"MaxHealth": 400000,
		"StartingEnergy": 0,
		"EnergyCost": 0,
		"PhysicalResist": 0,
		"EnergyResist": 0,
		"TenacityPercentage": 0,
		"WillpowerPercentage": 0,
		"Grit": 0,
		"Resolve": 0,
		"AttackPhysicalDamage": 0,
		"AttackEnergyDamage": 0,
		"AttackPureDamage": 0,
		"AttackSpeed": 0,
		"MoveSpeedSubUnits": 0,
		"HitChancePercentage": 0,
		"AttackDodgeChancePercentage": 0,
		"CritChancePercentage": 0,
		"CritAmplificationPercentage": 0,
		"OmegaPowerPercentage": 0,
		"AttackRangeUnits": 0,
		"OmegaRangeUnits": 0,
		"HealthRegeneration": 0,
		"EnergyRegeneration": 0,
		"EnergyGainEfficiencyPercentage": 0,
		"OnActivationEnergy": 0,
		"VulnerabilityPercentage": 0,
		"EnergyPiercingPercentage": 0,
		"PhysicalPiercingPercentage": 0,
		"HealthGainEfficiencyPercentage": 0,
		"PhysicalVampPercentage": 0,
		"EnergyVampPercentage": 0,
		"PureVampPercentage": 0,
		"Thorns": 0,
		"StartingShield": 0,
		"CritReductionPercentage": 0
	},
	"AttackAbilitiesSelection": "Cycle",
	"AttackAbilities": [],
	"OmegaAbilitiesSelection": "Cycle",
	"OmegaAbilities": [],
	"InnateAbilities": [
		{
			"Name": "TidalPenetration",
			"ActivationTrigger": {
				"TriggerType": "OnBattleStart"
			},
			"TotalDurationMs": 0,
			"Skills": [
				{
					"Name": "TidalPenetration_Ability",
					"Deployment": {
						"Type": "Direct",
						"PreDeploymentDelayPercentage": 0
					},
					"Targeting": {
						"Type": "Self"
					},
					"PercentageOfAbilityDuration": 0,
					"EffectPackage": {
						"Effects": [
							{
								"Type": "Buff",
								"Stat": "EnergyPiercingPercentage",
								"OverlapProcessType": "Stacking",
								"DurationMs": -1,
								"Expression": 70
							},
							{
								"Type": "Buff",
								"Stat": "PhysicalPiercingPercentage",
								"OverlapProcessType": "Stacking",
								"DurationMs": -1,
								"Expression": 70
							}
						]
					}
				}
			]
		}
	],
	"DisplayName": "Tidal Penetration",
	"DisplayDescription": "Gain 70% Resistance Piercing.",
	"Description": {
		"Format": "Gain 70% Resistance Piercing.",
		"Parameters": {}
	},
	"DisplayDescriptionNormalized": "Gain 70% Resistance Piercing."
}